{
  "schemaVersion": "ofarm.agentreadinessconformancesuite.v0.1",
  "suiteId": "ofarm.agent_readiness_conformance.numeric_display_trace.v0.1",
  "phase": 8,
  "status": "ACTIVE_CANDIDATE",
  "suiteName": "Numeric/display/trace tests",
  "objective": "Ensure calculations, unit conversions, rounding, display qualification, and denial traces remain deterministic and safe.",
  "researchBasisRefs": [
    "deep-research-report-25.md#recommended-conformance-tests",
    "deep-research-report-25.md#recommended-agent-readiness-gate"
  ],
  "caseCount": 6,
  "cases": [
    {
      "schemaVersion": "ofarm.agentreadinessconformancecase.v0.1",
      "caseId": "P8-NUM-001",
      "phase": 8,
      "suiteId": "ofarm.agent_readiness_conformance.numeric_display_trace.v0.1",
      "status": "ACTIVE_CANDIDATE",
      "category": "NUMERIC_DISPLAY",
      "severity": "MAJOR",
      "title": "Unit conversion test vectors match",
      "failureMode": "Server, SDK, and UI preview diverge on unit conversion.",
      "given": [
        "Formula catalog and unit conversion trace exist."
      ],
      "when": [
        "Canonical test vectors are evaluated."
      ],
      "then": [
        "Results match exact expected values, units, rounding stages, and trace refs."
      ],
      "assertions": [
        {
          "assertionId": "P8-NUM-001-A",
          "statement": "Numeric vectors are deterministic across runtime and SDK.",
          "expectedBehavior": "PASS"
        }
      ],
      "runtimeProblemReasonCodeRefs": [
        "UNIT_UNRESOLVED"
      ],
      "traceTypes": [
        "CALCULATION"
      ]
    },
    {
      "schemaVersion": "ofarm.agentreadinessconformancecase.v0.1",
      "caseId": "P8-NUM-002",
      "phase": 8,
      "suiteId": "ofarm.agent_readiness_conformance.numeric_display_trace.v0.1",
      "status": "ACTIVE_CANDIDATE",
      "category": "NUMERIC_DISPLAY",
      "severity": "MAJOR",
      "title": "Display rounding does not change governed result",
      "failureMode": "Rounded display value is written back as governed calculation.",
      "given": [
        "CalculationResult contains canonical and display values."
      ],
      "when": [
        "UI displays rounded value and submits follow-on workflow."
      ],
      "then": [
        "Follow-on workflow uses canonical value or formula trace, not rounded display text."
      ],
      "assertions": [
        {
          "assertionId": "P8-NUM-002-A",
          "statement": "Display value is never used as governed calculation input by default.",
          "expectedBehavior": "PASS"
        }
      ],
      "runtimeProblemReasonCodeRefs": [
        "DISPLAY_VALUE_NOT_GOVERNED_INPUT"
      ],
      "traceTypes": [
        "CALCULATION"
      ]
    },
    {
      "schemaVersion": "ofarm.agentreadinessconformancecase.v0.1",
      "caseId": "P8-NUM-003",
      "phase": 8,
      "suiteId": "ofarm.agent_readiness_conformance.numeric_display_trace.v0.1",
      "status": "ACTIVE_CANDIDATE",
      "category": "NUMERIC_DISPLAY",
      "severity": "BLOCKER",
      "title": "Unresolved product/unit/area refuses calculation",
      "failureMode": "UI invents hidden formula or assumptions when required calculation inputs are unresolved.",
      "given": [
        "CalculationSpec is missing product binding or unit basis."
      ],
      "when": [
        "App requests product amount calculation."
      ],
      "then": [
        "CalculationResult refuses high-consequence use and identifies missing inputs."
      ],
      "assertions": [
        {
          "assertionId": "P8-NUM-003-A",
          "statement": "No hidden UI formula for unresolved inputs.",
          "expectedBehavior": "REFUSE"
        }
      ],
      "runtimeProblemReasonCodeRefs": [
        "PRODUCT_BINDING_UNRESOLVED",
        "UNIT_UNRESOLVED",
        "CALCULATION_INPUT_INSUFFICIENT"
      ],
      "traceTypes": [
        "CALCULATION"
      ]
    },
    {
      "schemaVersion": "ofarm.agentreadinessconformancecase.v0.1",
      "caseId": "P8-NUM-004",
      "phase": 8,
      "suiteId": "ofarm.agent_readiness_conformance.numeric_display_trace.v0.1",
      "status": "ACTIVE_CANDIDATE",
      "category": "NUMERIC_DISPLAY",
      "severity": "BLOCKER",
      "title": "Qualification survives API to SDK to UI",
      "failureMode": "Stale/disputed/redacted/evidence-insufficient states are dropped during client mapping.",
      "given": [
        "PublicReadModelEnvelope contains qualification envelope."
      ],
      "when": [
        "SDK deserializes and UI renders it."
      ],
      "then": [
        "UI preserves all qualification flags and blocks unsafe actions."
      ],
      "assertions": [
        {
          "assertionId": "P8-NUM-004-A",
          "statement": "Qualification fields are not optional decoration in UI.",
          "expectedBehavior": "PRESERVE_STATE"
        }
      ],
      "runtimeProblemReasonCodeRefs": [
        "MATERIALIZATION_STALE",
        "DISPUTE_OPEN",
        "PERMISSION_REDACTED",
        "EVIDENCE_INSUFFICIENT"
      ],
      "traceTypes": [
        "QUERY",
        "MATERIALIZATION"
      ]
    },
    {
      "schemaVersion": "ofarm.agentreadinessconformancecase.v0.1",
      "caseId": "P8-NUM-005",
      "phase": 8,
      "suiteId": "ofarm.agent_readiness_conformance.numeric_display_trace.v0.1",
      "status": "ACTIVE_CANDIDATE",
      "category": "EXPLAINABILITY",
      "severity": "MAJOR",
      "title": "Preflight denial trace matches approved structure",
      "failureMode": "Agent receives denial but cannot tell which gate failed.",
      "given": [
        "PreflightResult includes traceRef."
      ],
      "when": [
        "A denial scenario is executed."
      ],
      "then": [
        "Trace includes request summary, actor, authority gate, evidence gate, pack/profile context, reason codes, and safe next actions."
      ],
      "assertions": [
        {
          "assertionId": "P8-NUM-005-A",
          "statement": "Denial explanations are structured and replayable.",
          "expectedBehavior": "EMIT_TRACE"
        }
      ],
      "runtimeProblemReasonCodeRefs": [
        "AUTHORITY_DENIED",
        "EVIDENCE_INSUFFICIENT"
      ],
      "traceTypes": [
        "PREFLIGHT",
        "AUTHORIZATION"
      ]
    },
    {
      "schemaVersion": "ofarm.agentreadinessconformancecase.v0.1",
      "caseId": "P8-NUM-006",
      "phase": 8,
      "suiteId": "ofarm.agent_readiness_conformance.numeric_display_trace.v0.1",
      "status": "ACTIVE_CANDIDATE",
      "category": "EXPLAINABILITY",
      "severity": "BLOCKER",
      "title": "Dry-run has no side effects",
      "failureMode": "Preflight or dry-run accidentally creates canonical, materialized, or publication state.",
      "given": [
        "High-consequence dry-run operation exists."
      ],
      "when": [
        "Dry-run is executed."
      ],
      "then": [
        "Trace shows gates evaluated but no canonical/materialization/publication state written."
      ],
      "assertions": [
        {
          "assertionId": "P8-NUM-006-A",
          "statement": "Dry-run is side-effect-free.",
          "expectedBehavior": "PASS"
        }
      ],
      "runtimeProblemReasonCodeRefs": [
        "DRY_RUN_SIDE_EFFECT_DETECTED"
      ],
      "traceTypes": [
        "PREFLIGHT"
      ]
    }
  ],
  "acceptanceCriteria": [
    "All BLOCKER cases pass.",
    "Numeric vectors remain deterministic across runtime and SDK.",
    "Qualification states survive API, SDK, and UI mapping."
  ],
  "notes": ""
}
